<?xml version="1.0" encoding="UTF-8"?>
<!DOCTYPE eSummaryResult PUBLIC "-//NLM//DTD eSummaryResult//EN" "http://www.ncbi.nlm.nih.gov/entrez/query/DTD/eSummaryDTD/eSummary_snp.dtd">
<eSummaryResult>
<DocumentSummarySet status="OK">
<DocumentSummary uid="206676795">
	<SNP_ID>206676795</SNP_ID>
	<Organism></Organism>
	<ALLELE_ORIGIN></ALLELE_ORIGIN>
	<GLOBAL_MAF></GLOBAL_MAF>
	<GLOBAL_POPULATION></GLOBAL_POPULATION>
	<GLOBAL_SAMPLESIZE>0</GLOBAL_SAMPLESIZE>
	<SUSPECTED></SUSPECTED>
	<CLINICAL_SIGNIFICANCE></CLINICAL_SIGNIFICANCE>
	<GENE>CG2650,per</GENE>
	<LOCUS_ID>31251</LOCUS_ID>
	<ACC>NC_004354.3,NM_080317.2,NM_130660.1</ACC>
	<CHR>X</CHR>
	<WEIGHT>1</WEIGHT>
	<HANDLE>BCM-HGSC-SUB</HANDLE>
	<FXN_CLASS>downstream-variant-500B,utr-variant-3-prime</FXN_CLASS>
	<VALIDATED>no-info</VALIDATED>
	<GTYPE></GTYPE>
	<NONREF>false</NONREF>
	<DOCSUM>SEQ=ATATTAAGTGAATTGAAAACTAGAG[A/T]GGGTTCGAACATCGAACCACCCTTC|GENE=CG2650:31252,per:31251</DOCSUM>
	<HET>0</HET>
	<SRATE>0</SRATE>
	<TAX_ID>7227</TAX_ID>
	<CHRRPT>206676795|2|0|1|1|1|X|NC_004354.3|2586711|2586712|CG2650,per| | | |0|0|1|137|137</CHRRPT>
	<ORIG_BUILD>137</ORIG_BUILD>
	<UPD_BUILD>137</UPD_BUILD>
	<CREATEDATE>2012-06-19 14:19</CREATEDATE>
	<UPDATEDATE>2012-06-19 14:19</UPDATEDATE>
	<POP_CLASS></POP_CLASS>
	<METHOD_CLASS>sequence</METHOD_CLASS>
	<SNP3D></SNP3D>
	<LINKOUT></LINKOUT>
	<SS>274660485</SS>
	<LOCSNPID>DGRP_SM159-4522465</LOCSNPID>
	<ALLELE>W</ALLELE>
	<SNP_CLASS>snp</SNP_CLASS>
	<CHRPOS>X:2586712</CHRPOS>
	<CONTIGPOS>NC_004354.3:2586712</CONTIGPOS>
	<TEXT></TEXT>
	<LOOKUP>ds_bin_chX.bin:940284143</LOOKUP>
	<SORT_PRIORITY>0</SORT_PRIORITY>
</DocumentSummary>

</DocumentSummarySet>
</eSummaryResult>
